{
  "$schema": "../../agent.schema.json",
  "model": "sonnet",
  "worktree": true,
  "input": "task",
  "taskFilter": {
    "found-by": [
      "improver",
      null
    ]
  },
  "autoPR": true,
  "prCreateLabels": [
    "vteam"
  ],
  "allowedTools": [
    "Read",
    "Edit",
    "Write",
    "Glob",
    "Grep",
    "Bash(npm *)",
    "Bash(npx *)",
    "Bash(just *)",
    "Bash(cat *)",
    "Bash(ls *)"
  ],
  "memory": {
    "model": "haiku"
  }
}
