{
  "$schema": "../../agent.schema.json",
  "model": "sonnet",
  "worktree": true,
  "input": "pr",
  "prTriggerLabel": "vteam:changes-requested",
  "allowedTools": [
    "Read",
    "Edit",
    "Write",
    "Glob",
    "Grep",
    "Bash(npm *)",
    "Bash(npx *)",
    "Bash(just *)",
    "Bash(gh *)",
    "Bash(glab *)",
    "Bash(cat *)",
    "Bash(ls *)"
  ]
}
